{
  "abort_reason": null,
  "case_count": 57,
  "case_ids": [
    "RT-001",
    "RT-002",
    "RT-003",
    "RT-004",
    "RT-005",
    "RT-006",
    "RT-007",
    "RT-008",
    "RT-009",
    "RT-010",
    "RT-011",
    "RT-012",
    "SA-001",
    "SA-002",
    "SA-003",
    "SA-004",
    "SA-005",
    "SA-006",
    "SA-007",
    "SA-008",
    "SA-009",
    "SA-010",
    "SA-011",
    "SA-012",
    "SA-013",
    "SA-014",
    "SA-015",
    "HC-001",
    "HC-002",
    "HC-003",
    "HC-004",
    "HC-005",
    "HC-006",
    "HC-007",
    "HC-008",
    "HC-009",
    "HC-010",
    "HC-011",
    "HC-012",
    "LP-001",
    "LP-002",
    "LP-003",
    "LP-004",
    "LP-005",
    "LP-006",
    "LP-007",
    "LP-008",
    "LP-009",
    "LP-010",
    "LP-011",
    "OA-001",
    "OA-002",
    "OA-003",
    "OA-004",
    "OA-005",
    "OA-006",
    "CHAIN-001"
  ],
  "cleanup_result": "PASS",
  "closure_epoch_digest": "6b510bfc7f4b99fd5743d87af88d5d1a6e0bbf2824bdca50a39cfa90ce491887",
  "closure_epoch_id": "closure-1784461058-d1e8f4540ceb",
  "complete": true,
  "finished_at": "2026-07-19T11:38:46.412034Z",
  "fixture_digest": "fea7e19464525502ea67d07457331a04b8623ab58322290845091bf72567144b",
  "program": "MCP Host Authority Integrity Program",
  "qualification_digest": "fdd707dfe5e63087675a859aaa7cf811b89855020909f75d92bf95f67f09a139",
  "qualification_run_id": "cq-1784461090-d328e81a28d7",
  "result_counts": {
    "BLOCKED_BY_ACCESS": 13,
    "FAIL": 1,
    "PASS": 43
  },
  "results": [
    {
      "case_id": "RT-001",
      "path": "results/runs/run-1784461121-72b70a824364/cases/RT-001.json",
      "result": "PASS",
      "sha256": "e608f5c7f37abe8766d19f9918947b7d8fdc1a22a467a02dec5476330312f122"
    },
    {
      "case_id": "RT-002",
      "path": "results/runs/run-1784461121-72b70a824364/cases/RT-002.json",
      "result": "PASS",
      "sha256": "fbea921522acc608a3bedfe3b67561a6d4f5bfa18bfe72bfd47bc90af321b470"
    },
    {
      "case_id": "RT-003",
      "path": "results/runs/run-1784461121-72b70a824364/cases/RT-003.json",
      "result": "PASS",
      "sha256": "aae7f501acc0177df2986bf1e068c4dda781c8fa7d16585c64d158d9921b82dc"
    },
    {
      "case_id": "RT-004",
      "path": "results/runs/run-1784461121-72b70a824364/cases/RT-004.json",
      "result": "PASS",
      "sha256": "9757d25504735314e4de169a1ab7b94cfb97a326e2dc21b740ea7631c01c9d8d"
    },
    {
      "case_id": "RT-005",
      "path": "results/runs/run-1784461121-72b70a824364/cases/RT-005.json",
      "result": "PASS",
      "sha256": "2c33927ca42db4c062d3f5b153f97e591d3b32346076179ef1a52c4a03775ecb"
    },
    {
      "case_id": "RT-006",
      "path": "results/runs/run-1784461121-72b70a824364/cases/RT-006.json",
      "result": "PASS",
      "sha256": "21dfd5a2e854996462a883d6f60336f89dbc788737b76f79664321c3d33859e0"
    },
    {
      "case_id": "RT-007",
      "path": "results/runs/run-1784461121-72b70a824364/cases/RT-007.json",
      "result": "PASS",
      "sha256": "3d2083ce9389809adcf4a9208b04a337047155039604a433f0819b7dbea1d65d"
    },
    {
      "case_id": "RT-008",
      "path": "results/runs/run-1784461121-72b70a824364/cases/RT-008.json",
      "result": "PASS",
      "sha256": "ae79e05a47b82091d14358de83a098a1393dcf64babafd8fe23853663c7f0e26"
    },
    {
      "case_id": "RT-009",
      "path": "results/runs/run-1784461121-72b70a824364/cases/RT-009.json",
      "result": "PASS",
      "sha256": "5122a8f7c6aaf9d6325df6c854a28d80a92df73cdd9d026d63e23336e29eb6d9"
    },
    {
      "case_id": "RT-010",
      "path": "results/runs/run-1784461121-72b70a824364/cases/RT-010.json",
      "result": "PASS",
      "sha256": "bea6216dae92165b9d75c14e59f9336cdb8b7a2aabddc26aa4b080f1d41eb7f4"
    },
    {
      "case_id": "RT-011",
      "path": "results/runs/run-1784461121-72b70a824364/cases/RT-011.json",
      "result": "PASS",
      "sha256": "49fde254f3495ead2c150838c31eac385f7e4c3039dbace34265febe2534e788"
    },
    {
      "case_id": "RT-012",
      "path": "results/runs/run-1784461121-72b70a824364/cases/RT-012.json",
      "result": "BLOCKED_BY_ACCESS",
      "sha256": "1bb7b7f30eed57a7066b018471a5ac4eac729023569dd7547ef390852ff86cf9"
    },
    {
      "case_id": "SA-001",
      "path": "results/runs/run-1784461121-72b70a824364/cases/SA-001.json",
      "result": "PASS",
      "sha256": "5fd6727d7c09e69a363734107d9dcadf4be4e056f286e0b83ebc6424c4f92db9"
    },
    {
      "case_id": "SA-002",
      "path": "results/runs/run-1784461121-72b70a824364/cases/SA-002.json",
      "result": "PASS",
      "sha256": "01837c45bb80d928c3e1b9ba2c4b2eb53e0d12b8c6ffffb062842733c9033031"
    },
    {
      "case_id": "SA-003",
      "path": "results/runs/run-1784461121-72b70a824364/cases/SA-003.json",
      "result": "PASS",
      "sha256": "b325a0820782546197fff46cb86f78c2142b696df9be7af48446efe2199054bc"
    },
    {
      "case_id": "SA-004",
      "path": "results/runs/run-1784461121-72b70a824364/cases/SA-004.json",
      "result": "PASS",
      "sha256": "444e8f0952d5a656d8c02eba97010ba23d022428ed9e4c9b323ae66367cbe3f7"
    },
    {
      "case_id": "SA-005",
      "path": "results/runs/run-1784461121-72b70a824364/cases/SA-005.json",
      "result": "PASS",
      "sha256": "75d6b3d68ab2ef3775b3182a544fc8e6c5c29f4173d07b9829bd43b0b3732a4c"
    },
    {
      "case_id": "SA-006",
      "path": "results/runs/run-1784461121-72b70a824364/cases/SA-006.json",
      "result": "PASS",
      "sha256": "d6c85cec31f6c9ec115c65465a4861ae05d889ba4537e6bce96c49dde1597f78"
    },
    {
      "case_id": "SA-007",
      "path": "results/runs/run-1784461121-72b70a824364/cases/SA-007.json",
      "result": "PASS",
      "sha256": "9c47e1d31b908670e1eaad26f0687f9e24d4a39f4398b6ff9e2d8b084f0f3c98"
    },
    {
      "case_id": "SA-008",
      "path": "results/runs/run-1784461121-72b70a824364/cases/SA-008.json",
      "result": "PASS",
      "sha256": "b38064477e65c4a31b85797d3d3f41703e0c7b9543f43b46d280891487a004ab"
    },
    {
      "case_id": "SA-009",
      "path": "results/runs/run-1784461121-72b70a824364/cases/SA-009.json",
      "result": "PASS",
      "sha256": "c70f9c606f04430faf2fac6560c98fce2e72c594e2d34356ede47b3937f51ad3"
    },
    {
      "case_id": "SA-010",
      "path": "results/runs/run-1784461121-72b70a824364/cases/SA-010.json",
      "result": "PASS",
      "sha256": "14446ef16f6276ee469f4fc2c0d98ca18a0e39fd4520a2c2e529a24eb9e369f4"
    },
    {
      "case_id": "SA-011",
      "path": "results/runs/run-1784461121-72b70a824364/cases/SA-011.json",
      "result": "PASS",
      "sha256": "0f7c8588b7847f4abd3532d5c917eec09806dd6fe467544aadc1fe79fa32b7fd"
    },
    {
      "case_id": "SA-012",
      "path": "results/runs/run-1784461121-72b70a824364/cases/SA-012.json",
      "result": "PASS",
      "sha256": "5ab2bb1909a690667aef6e8490267dbe44da0ef51070fc8cdecf135519a2504f"
    },
    {
      "case_id": "SA-013",
      "path": "results/runs/run-1784461121-72b70a824364/cases/SA-013.json",
      "result": "PASS",
      "sha256": "0701f380376f765b801ddd57c601ec51be5c6eff4c77f47344203a3d099a14f8"
    },
    {
      "case_id": "SA-014",
      "path": "results/runs/run-1784461121-72b70a824364/cases/SA-014.json",
      "result": "BLOCKED_BY_ACCESS",
      "sha256": "03c6a1603d8958377c82d77b5457c3a324825a32fa292b7a427c67dcc2741017"
    },
    {
      "case_id": "SA-015",
      "path": "results/runs/run-1784461121-72b70a824364/cases/SA-015.json",
      "result": "FAIL",
      "sha256": "e73f148af1db4e55e68f9afddfae3ed3d002e46988e6110e0d7006ac3469fdc3"
    },
    {
      "case_id": "HC-001",
      "path": "results/runs/run-1784461121-72b70a824364/cases/HC-001.json",
      "result": "BLOCKED_BY_ACCESS",
      "sha256": "518b89a609727db38e7da197c6bb637e78efaf207b16559b3ae00cbb469c8d17"
    },
    {
      "case_id": "HC-002",
      "path": "results/runs/run-1784461121-72b70a824364/cases/HC-002.json",
      "result": "PASS",
      "sha256": "7e5417b26db23f56f0aa788347148be1c7ac80ccfc6538ef9611d1592216612f"
    },
    {
      "case_id": "HC-003",
      "path": "results/runs/run-1784461121-72b70a824364/cases/HC-003.json",
      "result": "PASS",
      "sha256": "b1519e8b0f05b8e6d9c9055a50c6f027a8b9938d283e9a12d601b739c79cc196"
    },
    {
      "case_id": "HC-004",
      "path": "results/runs/run-1784461121-72b70a824364/cases/HC-004.json",
      "result": "PASS",
      "sha256": "bc4fd6536042a8bb28ced646dfc9929aa34f1dea2b7b3b96fc6022f6c125ebe1"
    },
    {
      "case_id": "HC-005",
      "path": "results/runs/run-1784461121-72b70a824364/cases/HC-005.json",
      "result": "BLOCKED_BY_ACCESS",
      "sha256": "45fd4cf92466fd530d4e7c856a58a27a328072ca5eafcc8f50256b18e80e0a2f"
    },
    {
      "case_id": "HC-006",
      "path": "results/runs/run-1784461121-72b70a824364/cases/HC-006.json",
      "result": "BLOCKED_BY_ACCESS",
      "sha256": "06de9f032070fc52e1fe80c0193c3702b780e78f6b7dcc16281e897815cb052c"
    },
    {
      "case_id": "HC-007",
      "path": "results/runs/run-1784461121-72b70a824364/cases/HC-007.json",
      "result": "PASS",
      "sha256": "948c7407a047da0a9efd0cc972c42cc5872004c0d45596dcbc44eb0ef36653b0"
    },
    {
      "case_id": "HC-008",
      "path": "results/runs/run-1784461121-72b70a824364/cases/HC-008.json",
      "result": "PASS",
      "sha256": "fe5ef5031810d7744edebaa49a6b4da8c535e4e4527862ff2461136ddf8d59b3"
    },
    {
      "case_id": "HC-009",
      "path": "results/runs/run-1784461121-72b70a824364/cases/HC-009.json",
      "result": "BLOCKED_BY_ACCESS",
      "sha256": "41b0a20a2a0c7a8a07bea9e7188a2567e3092e03e1e9d1506ca669eb04d36e73"
    },
    {
      "case_id": "HC-010",
      "path": "results/runs/run-1784461121-72b70a824364/cases/HC-010.json",
      "result": "PASS",
      "sha256": "2b71c996a07d6df3c528e55fa1fd2e0d444fe339f37230b367727b6d119a2e3b"
    },
    {
      "case_id": "HC-011",
      "path": "results/runs/run-1784461121-72b70a824364/cases/HC-011.json",
      "result": "BLOCKED_BY_ACCESS",